{
  "$schema": "../../packages/core/schema/config.json",
  "backend": {
    "name": "github",
    "repo": "phishinqi/astro-theme-v7",
    "branch": "main"
  },
  "media": {
    "provider": "repo",
    "repoPath": "public/images/uploads",
    "publicPath": "/images/uploads",
    "maxEdge": 2400,
    "exif": true
  },
  "locale": "zh-CN",
  "editorialWorkflow": true,
  "preview": {
    "devServerURL": "http://localhost:4321",
    "pathTemplate": "/posts/{{slug}}/"
  },
  "collections": [
    {
      "kind": "fields",
      "name": "posts-md",
      "label": "文章 · Markdown",
      "folder": "content/posts",
      "extension": "md",
      "format": "frontmatter",
      "identifierField": "slug",
      "contentField": "body",
      "nested": true,
      "fields": [
        {
          "name": "title",
          "widget": "string",
          "label": "标题",
          "required": true
        },
        {
          "name": "description",
          "widget": "text",
          "label": "摘要",
          "required": true
        },
        {
          "name": "slug",
          "widget": "string",
          "label": "永久链接 slug",
          "pattern": ["^[a-z0-9]+(?:-[a-z0-9]+)*$", "使用小写英文、数字和连字符。"],
          "required": true
        },
        {
          "name": "pubDate",
          "widget": "datetime",
          "label": "发布时间",
          "required": true
        },
        {
          "name": "updatedDate",
          "widget": "datetime",
          "label": "更新时间",
          "required": false
        },
        {
          "name": "category",
          "widget": "relation",
          "label": "分类",
          "collection": "categories",
          "valueField": "id",
          "required": true,
          "categoryFile": "data/categories.json"
        },
        {
          "name": "tags",
          "widget": "list",
          "label": "标签",
          "required": false,
          "field": {
            "name": "tag",
            "widget": "string"
          },
          "tagFile": "data/tags.json"
        },
        {
          "name": "authors",
          "widget": "list",
          "label": "作者",
          "required": false,
          "field": {
            "name": "author",
            "widget": "relation",
            "collection": "authors",
            "valueField": "id"
          },
          "authorFile": "data/authors.json"
        },
        {
          "name": "lang",
          "widget": "select",
          "label": "语言",
          "options": ["zh-CN", "en"]
        },
        {
          "name": "draft",
          "widget": "boolean",
          "label": "草稿",
          "required": false
        },
        {
          "name": "featured",
          "widget": "boolean",
          "label": "精选",
          "required": false
        },
        {
          "name": "cover",
          "widget": "object",
          "label": "封面",
          "required": false,
          "collapseEmpty": true,
          "fields": [
            {
              "name": "src",
              "widget": "image",
              "label": "图片"
            },
            {
              "name": "alt",
              "widget": "string",
              "label": "替代文本"
            },
            {
              "name": "width",
              "widget": "number",
              "label": "宽度"
            },
            {
              "name": "height",
              "widget": "number",
              "label": "高度"
            },
            {
              "name": "focal",
              "widget": "string",
              "label": "裁切焦点",
              "required": false
            },
            {
              "name": "caption",
              "widget": "string",
              "label": "说明",
              "required": false
            }
          ]
        },
        {
          "name": "ogImage",
          "widget": "image",
          "label": "分享图",
          "required": false
        },
        {
          "name": "body",
          "widget": "markdown",
          "label": "正文"
        }
      ]
    },
    {
      "kind": "fields",
      "name": "posts-mdx",
      "label": "文章 · MDX 源码",
      "folder": "content/posts",
      "extension": "mdx",
      "format": "frontmatter",
      "identifierField": "slug",
      "contentField": "body",
      "nested": true,
      "fields": [
        {
          "name": "title",
          "widget": "string",
          "label": "标题",
          "required": true
        },
        {
          "name": "description",
          "widget": "text",
          "label": "摘要",
          "required": true
        },
        {
          "name": "slug",
          "widget": "string",
          "label": "永久链接 slug",
          "required": true
        },
        {
          "name": "pubDate",
          "widget": "datetime",
          "label": "发布时间",
          "required": true
        },
        {
          "name": "category",
          "widget": "relation",
          "label": "分类",
          "collection": "categories",
          "valueField": "id",
          "required": true,
          "categoryFile": "data/categories.json"
        },
        {
          "name": "tags",
          "widget": "list",
          "label": "标签",
          "required": false,
          "field": {
            "name": "tag",
            "widget": "string"
          },
          "tagFile": "data/tags.json"
        },
        {
          "name": "authors",
          "widget": "list",
          "label": "作者",
          "required": false,
          "field": {
            "name": "author",
            "widget": "relation",
            "collection": "authors",
            "valueField": "id"
          },
          "authorFile": "data/authors.json"
        },
        {
          "name": "lang",
          "widget": "select",
          "label": "语言",
          "options": ["zh-CN", "en"]
        },
        {
          "name": "draft",
          "widget": "boolean",
          "label": "草稿",
          "required": false
        },
        {
          "name": "featured",
          "widget": "boolean",
          "label": "精选",
          "required": false
        },
        {
          "name": "body",
          "widget": "source",
          "label": "正文源码"
        }
      ]
    },
    {
      "kind": "fields",
      "name": "albums",
      "label": "相册",
      "folder": "content/albums",
      "extension": "md",
      "format": "frontmatter",
      "identifierField": "slug",
      "contentField": "body",
      "media": {
        "repoPath": "public/images/albums/{{slug}}",
        "publicPath": "/images/albums/{{slug}}"
      },
      "fields": [
        {
          "name": "title",
          "widget": "string",
          "label": "标题",
          "required": true
        },
        {
          "name": "slug",
          "widget": "string",
          "label": "slug",
          "required": true
        },
        {
          "name": "date",
          "widget": "datetime",
          "label": "日期",
          "format": "YYYY-MM-DD",
          "required": true
        },
        {
          "name": "draft",
          "widget": "boolean",
          "label": "草稿",
          "required": false
        },
        {
          "name": "description",
          "widget": "text",
          "label": "简介",
          "required": false
        },
        {
          "name": "authors",
          "widget": "list",
          "label": "作者",
          "required": false,
          "field": {
            "name": "author",
            "widget": "relation",
            "collection": "authors",
            "valueField": "id"
          },
          "authorFile": "data/authors.json"
        },
        {
          "name": "tags",
          "widget": "list",
          "label": "相册标签",
          "required": false,
          "field": {
            "name": "tag",
            "widget": "relation",
            "collection": "photoTags",
            "valueField": "id"
          }
        },
        {
          "name": "cover",
          "widget": "string",
          "label": "封面图片 ID（留空使用第一张）",
          "required": false
        },
        {
          "name": "images",
          "widget": "list",
          "label": "图片",
          "labelSingular": "图片",
          "summary": "{{title}} · {{src}}",
          "fields": [
            {
              "name": "src",
              "widget": "image",
              "label": "图片",
              "hint": "上传时自动压缩为 WebP 并移除 EXIF。",
              "required": true
            },
            {
              "name": "alt",
              "widget": "string",
              "label": "替代文本（描述画面，供读屏与加载失败时使用）",
              "required": true
            },
            {
              "name": "id",
              "widget": "string",
              "label": "图片 ID（用于分享链接）",
              "required": false
            },
            {
              "name": "kind",
              "widget": "select",
              "label": "类型",
              "options": [
                {
                  "label": "照片",
                  "value": "photo"
                },
                {
                  "label": "创作",
                  "value": "artwork"
                }
              ],
              "default": "photo"
            },
            {
              "name": "title",
              "widget": "string",
              "label": "标题",
              "required": false
            },
            {
              "name": "caption",
              "widget": "text",
              "label": "说明",
              "required": false
            },
            {
              "name": "date",
              "widget": "datetime",
              "label": "拍摄 / 创作日期",
              "format": "YYYY-MM-DD",
              "required": false
            },
            {
              "name": "location",
              "widget": "string",
              "label": "地点",
              "required": false
            },
            {
              "name": "tags",
              "widget": "list",
              "label": "标签",